{
  "jornadaId": "JORNADA-BORRADOR-SUPERVISOR",
  "estado": "ACTIVA",
  "version": 3,
  "cantidadLineas": 1,
  "cantidadParticipantes": 2,
  "jornadaLineaIds": ["JORNADA-BORRADOR-SUPERVISOR__LINEA-CATALOGO-LIBRE-1"],
  "participanteIds": ["uid-auxiliar-1", "uid-supervisor"],
  "activadaEn": "2026-07-15T19:00:00.000Z"
}
